id,created_at,text
358402587881508864,2013-07-20 01:46:50,"If I didn't exist, it would be necessary to invent Me just to send the Westboro Baptist Church to hell."
358392669493395457,2013-07-20 01:07:25,"If you find yourself in a position where you have to say ""I'm not racist"", you're probably racist."
358282319494254595,2013-07-19 17:48:56,The Bible is 100% accurate. Especially when thrown at close range.
358260119173218305,2013-07-19 16:20:43,"Texas now wants to ban all abortions after six weeks. In its defense, who wouldn't want to die after living six weeks in Texas?"
357965595402186753,2013-07-18 20:50:23,These days I outsource 95% of your prayers to Bangalore.
357927629233467392,2013-07-18 18:19:31,One day your fossilized bones will be burned for fuel and I'll laugh and laugh and laugh.
357863380943515648,2013-07-18 14:04:13,The world is full of too much misunderstanding and not enough not even trying to understand.
357570635624484865,2013-07-17 18:40:57,In My experience the best way to sustain a long-distance relationship is through a total lack of communication.
357361895033946113,2013-07-17 04:51:29,Wrong people are just as sure right people are wrong as right people are sure wrong people are wrong. The only difference is they're wrong.
357304679631294466,2013-07-17 01:04:08,Don't worry about things you can't control. Instead worry about things you wrongly think you can.
357252819616665600,2013-07-16 21:38:04,I don't recall Native Americans being encouraged to 'stand their ground'.
357175127466708994,2013-07-16 16:29:21,"""This is a fake account!"" No, you're thinking of Genesis."
357165658208878593,2013-07-16 15:51:43,"If you can dream it, you can do it. Now get out there and show up naked and unprepared for your final exam!"
357116009246752769,2013-07-16 12:34:26,To believe in the Bible it helps not to read it.
356977782317785089,2013-07-16 03:25:10,"You do know you're destroying your only home, right? Like, not abstractly. For reals."
356942845002788864,2013-07-16 01:06:20,My password for the universe is 1234.
356819708168781825,2013-07-15 16:57:02,Actually 666 is only the Area Code of the Beast. His full number is unlisted.
356692386920927232,2013-07-15 08:31:06,"Due to excess demand I am no longer accepting prayers for world peace, ponies, promotions, sports victories or a night with Natalie Portman."
356645801113563136,2013-07-15 05:25:59,Retweet this to raise awareness of this tweet. #EveryRTMakesADifference
356623626356801537,2013-07-15 03:57:52,You can lead a horse to water but you can't make him accept that the water wasn't placed there by an invisible sky-horse.
356574801558646785,2013-07-15 00:43:52,Imagine if your boss had a son and as long as you hung out with him you could treat people in the office like shit and never lose your job.
356273039396188164,2013-07-14 04:44:46,"For the last time: this is not a parody account. I am God, tweeting as God, using an iPhone like God, and speaking just like fucking God."
356255200828338177,2013-07-14 03:33:53,"Even I think Zimmerman was guilty, and I'm an old white guy."
356242059738357760,2013-07-14 02:41:40,I have never been more ashamed of making Florida the model for the human penis.
356232670247784449,2013-07-14 02:04:21,Injustice is the fabric holding the universe together.
356231273083187200,2013-07-14 01:58:48,"Give a man a fish and he'll eat for a day. But why are you walking around giving men fish? That's weird, dude."
356093855138971648,2013-07-13 16:52:45,"The far far right is old and white
Deep in the heart of Texas.
They flash their badge inside your vaj
Deep in the heart of Texas."
355887284970725376,2013-07-13 03:11:55,It's always the people who believe in divine judgment who deserve it the most.
355807874485731329,2013-07-12 21:56:22,"Once in a while people do something so stupid, even My son yells ""Jesus fucking Christ!"""
355743626426449920,2013-07-12 17:41:04,"No matter what the verdict in the #ZimmermanTrial, he's already guilty of one thing: murder."
355713641493966851,2013-07-12 15:41:55,It's not that he liked big butts; it's that he could not lie. THAT'S why Sir Mix-a-Lot deserved his knighthood.
355691668026036224,2013-07-12 14:14:36,You are 100% biodegradable. #green
355528105340829696,2013-07-12 03:24:40,"SHARKNADO SEQUELS

Wolfcano
Bearnami
Hippoquake
Piranhurricane
Tarantulavalanche
Lizard Blizzard"
355496957994733568,2013-07-12 01:20:54,Sharknados! Why didn't I think of that?
355112440305946624,2013-07-10 23:52:58,"Which came first, the chicken or the egg? Neither. The rooster came first."
354992010391859201,2013-07-10 15:54:25,The least developed form of man is Homo phobicus.
354821933893824513,2013-07-10 04:38:35,"The most ""traditional American values"" include respecting the land, living in tents, and using every part of the buffalo."
354768775368802307,2013-07-10 01:07:21,I just fucking hate Sarah Palin.
354744711744978944,2013-07-09 23:31:44,"Mexico is now the world's fattest populous country. America is #2. Canada's not even Top Ten! Dammit, hosers, put extra syrup on that bacon!"
354686345249165313,2013-07-09 19:39:49,I can beat up Thor any day of the week. Including his.
354593353540698112,2013-07-09 13:30:18,Life is a journey. Death is the destination.
354475572153417730,2013-07-09 05:42:16,I've got the best fans in the whole world because they're the kind of fans willing to kill themselves and each other to prove they are.
354409953760509953,2013-07-09 01:21:32,The bad weather will continue until the climate improves.
354266389432905729,2013-07-08 15:51:03,That awkward moment when you tell Eve a tiny man will be living in her uterus for 9 months before emerging watermelon-sized from her vagina.
354099290949423104,2013-07-08 04:47:04,"""It was God's will"" is functionally indistinguishable from ""Shit happens""."
354029189764100097,2013-07-08 00:08:31,It all makes sense if you don't think about it.
354023574325051392,2013-07-07 23:46:12,Earth was the first world I created. It has all kinds of problems. #firstworldproblems
354004538618945538,2013-07-07 22:30:33,"I wish Twitter would verify Me. Hell, I wish ANYBODY would verify Me."
353912630039150593,2013-07-07 16:25:21,"You're welcome, Britain."
353308024741441537,2013-07-06 00:22:51,I call your name during sex.
353234463121088513,2013-07-05 19:30:33,"Egypt is one of those rare countries whose ""good old days"" were in 2,000 B.C."
353211118933643265,2013-07-05 17:57:47,Paranoia can be a rewarding alternative to accepting the fact nobody cares about you.
353162507982077953,2013-07-05 14:44:38,To the many Americans waking up this morning with a patriotism hangover: I'm afraid the only cure is invading another country.
353017174840975360,2013-07-05 05:07:07,Retweet this if you don't believe in its Author.
352956416421670913,2013-07-05 01:05:41,A fireworks show is like a gay missile attack.
352929909712228353,2013-07-04 23:20:22,Having a BBQ in heaven. I just swiped one of Adam's ribs. Seems like old times.
352922632716423170,2013-07-04 22:51:27,Here's an interview with a guy who claims to work with Me but way overstates his involvement. Plus he mumbles a lot. http://t.co/yx7EPd5g63
352914282138181632,2013-07-04 22:18:16,The main difference between the Gay Pride parade and the Fourth of July parade is the people in the Gay Pride parade KNOW they're gay.
352825140821766148,2013-07-04 16:24:03,"""We hold these truths to be self-evident, that all men are created equal."" - A man who owned other men."
352490867354898432,2013-07-03 18:15:46,I Saved the Queen!
352468934986956800,2013-07-03 16:48:37,"Wow, Andy Murray really looked Scottish in those first two sets. But he took that third like a true Englishman!"
352467172624318464,2013-07-03 16:41:37,"To the people asking Me to intervene in Tahrir: Sorry, but acting in the best interest of Egyptians has never been My strong suit."
352442537048408064,2013-07-03 15:03:43,"""Hail Satan"" is trending. Good for him! He's a hard-working guy who doesn't get enough credit."
352298651953004545,2013-07-03 05:31:58,You're My World of Warcraft.
352104567174991874,2013-07-02 16:40:45,"For many people, ""live and learn"" is one task too many."
352049658933161987,2013-07-02 13:02:34,"Jews, Christians and Muslims all worship the same God. I'm like pie: Sometimes plain, and sometimes Allah mode."
351891850703015938,2013-07-02 02:35:29,How did that one kid in kindergarten who hit people and threw tantrums and made everybody miserable grow up to be half the adult population?
351836189822689280,2013-07-01 22:54:19,"The wise man chooses his words carefully, while the fool says stupid shit."
351707785165148160,2013-07-01 14:24:05,Happy Canada Day to the country whose job is to sit on top of America and keep it from exploding.
351432742237511682,2013-06-30 20:11:09,I worked in the cloud before it was cool.
351406201973645313,2013-06-30 18:25:42,Sexuality is a choice. Mine.
351389465278816256,2013-06-30 17:19:11,"""God is just dog backwards!"" But in German God is Gott, which backwards is Ttog, which stands for... @TheTweetOfGod. #game #set #match"
351339520857350144,2013-06-30 14:00:44,You are the result of both four billion years of evolution and two minutes of drunken rubbing.
351201247996547073,2013-06-30 04:51:17,Retweeting this counts as going to church. Favoriting this counts as filling the collection plate.
351162608839168000,2013-06-30 02:17:44,If you had more money you'd be happier.
351138328847982592,2013-06-30 00:41:16,Dance like nobody's watching. But masturbate like everyone is.
350976184818999296,2013-06-29 13:56:57,Sometimes I love you all so much I want to kill you and bring you up here and hug you.
350858583069560834,2013-06-29 06:09:39,There's no such thing as God's law. But there is such a thing as God slaw. I make it with paprika! #qualitysidedish
350796757808070656,2013-06-29 02:03:59,Just because some idiot disagrees with you doesn't make you not an idiot.
350409259076423680,2013-06-28 00:24:12,"Everyone at the #NBADraft is thanking Me. You're welcome, fellas! Looking forward to deciding who wins your games!"
350118037078282241,2013-06-27 05:06:59,There is no master plan. I can't stress this enough.
350041980883058690,2013-06-27 00:04:46,Anyone who thinks human life is sacred to Me has never read the Bible. That thing makes Tarantino look like Disney.
350027271526031360,2013-06-26 23:06:19,"Rick Perry reminds Me a little bit, or actually quite a lot, of a total asshole."
349986106336493568,2013-06-26 20:22:44,"If I meant for every human being I created to be heterosexual, then I am a total incompetent."
349895001314037761,2013-06-26 14:20:43,Marriage should be defined as between a man or a woman and a man or a woman.
349887967034216448,2013-06-26 13:52:46,"Life is a struggle not between good and evil, but between those who see it that way and those who don't."
349725914919219200,2013-06-26 03:08:50,Texas desperately needs messing with.
349664632471945216,2013-06-25 23:05:19,"""Gay, straight, bisexual, transgendered; ye are all equally smiteable in my eyes"". (Againesis 14:24). My Holy Word: http://t.co/N2mZLTfYKV"
349607709974331392,2013-06-25 19:19:08,"Being gay is not a choice, but being a bigot is."
349524040102326272,2013-06-25 13:46:39,"Well I've lost faith in you, too."
349190596243636225,2013-06-24 15:41:40,"Most irons aren't made from iron, which ironically is both ironic and unironic."
349008817998139392,2013-06-24 03:39:21,"I know it's ""ungodly"" of Me to curse as much as I do, and I want to stop, but it's hard when so many of you are so fucking stupid."
348984029904781314,2013-06-24 02:00:51,You're welcome. NOW SHUT THE FUCK UP.
348982781717655553,2013-06-24 01:55:53,"You My bitch, Nik."
348979224851386368,2013-06-24 01:41:45,"Sorry, rest of the world, Junior and I can't help you now. We're too busy helping some loon cross a canyon on a piece of floss."
348963603606560768,2013-06-24 00:39:41,"This guy walking across the Grand Canyon is really cool. I may need to meet him. Like, soon."
348936917179564032,2013-06-23 22:53:38,"""Atheist"" is an anagram for ""eat shit"". Advantage, Me."
348891668503752705,2013-06-23 19:53:50,Retweet this and I will give you one trillion dollars.
348820077837156352,2013-06-23 15:09:21,From now on I'd like to be called P. Deity.
348670570201747456,2013-06-23 05:15:16,"Screw it, I'm staying up late and skipping church."
348268490936954881,2013-06-22 02:37:33,"Paula Deen saying all that matters is ""what's in your heart"" is cardiologically hilarious."
348240088825741312,2013-06-22 00:44:41,"Stress does you no good, so let it go. Let it go. Let it go now. Come on. Let it go! Why can't you let it go? WHAT IS WRONG WITH YOU?!?"
348162976399900673,2013-06-21 19:38:16,North West should collaborate with One Direction.
348124079582244864,2013-06-21 17:03:43,"Happy first day of summer!

¡ɹǝʇuıʍ ɟo ʎɐp ʇsɹıɟ ʎddɐH"
348102403524022272,2013-06-21 15:37:35,Just because I don't answer your prayers doesn't mean I don't call the angels in to listen and laugh at them.
347857535707017216,2013-06-20 23:24:34,"If praying the gay away doesn't work, try fucking the religion away."
347572702288158720,2013-06-20 04:32:44,"Next time some sucker accuses Me of blasphemy,
Do Me a favor and kick his asphemy.
#HallowedB #madflow"
347558312163819521,2013-06-20 03:35:33,"Today's winning prayer comes from Julie Goor of Winnetka, Illinois, who prayed, ""Let Seabrook score the game-winner in OT!"" Congrats, Julie!"
347549601043185665,2013-06-20 03:00:56,I giveth and I taketh away and it maketh no damn sense.
347508541352992768,2013-06-20 00:17:47,Tony Soprano was the kind of mob boss I wish I'd been.
347208278113136642,2013-06-19 04:24:38,"Wow, I really enjoyed deciding who won that game."
347200474560217089,2013-06-19 03:53:38,"#Spurs fans, #Heat fans, make your case to Me. Hurry up; I'm due in a meth-head's delusion in ten minutes."
347120365224468484,2013-06-18 22:35:18,"The thing you are currently stressing over at work is stupid. This is always true, for everyone."
347049026484580352,2013-06-18 17:51:50,Just because someone's richer or more famous or talented doesn't mean they're happy. It just means they're happier than YOU.
347038244560592899,2013-06-18 17:08:59,"The big difference between me and Kanye is I impregnated a virgin, whereas Kanye... well, did not."
346821501502242816,2013-06-18 02:47:44,"Sometimes Jesus asks himself, ""What would some self-righteous hypocrite do?"""
346783392844615680,2013-06-18 00:16:18,People loooove talking about the weather and haaaate talking about the climate.
346630597571121152,2013-06-17 14:09:09,"Canada, never elect mayors again."
346461003107692544,2013-06-17 02:55:14,"You're welcome, Danny Green! It was a pleasure for Me to personally ensure you played well and your team won tonight! #ThatsWhatImHereFor"
346443031626526721,2013-06-17 01:43:49,Deciding the outcome of sporting events is the toughest part of My job.
346381416822628352,2013-06-16 21:38:59,"You're welcome, Phil."
346347068115283969,2013-06-16 19:22:30,"Never be afraid to fail. What's the point? You're gonna fail anyway, you failure. #truth"
346294358351429632,2013-06-16 15:53:03,Jesus also made Me breakfast in bed. It's wafers and wine. #awkward #nothungry
346263020114149377,2013-06-16 13:48:31,Happy Father's Day from your heavenly deadbeat Dad.
346095120615100416,2013-06-16 02:41:21,Retweet this to let your followers know you're available for sex tonight.
345759089600651264,2013-06-15 04:26:05,I could totally beat Superman in a fight.
345608519879389184,2013-06-14 18:27:46,"Today is Flag Day, America, so be sure to take a moment to thank the Chinese for making all your flags."
345602096965509120,2013-06-14 18:02:15,"Priests should not have to live in a state of forced celibacy, but be free to marry and let celibacy slowly descend upon them the usual way."
345564504672829440,2013-06-14 15:32:52,Facts are what beliefs want to be when they grow up.
345366073660567553,2013-06-14 02:24:23,"You are free to criticize athletes. They are free to criticize you too of course, but they don't, because your job is dull and no one cares."
345361679154024448,2013-06-14 02:06:55,"""Despicable Me 2"" was My original title for the New Testament."
345337762095980544,2013-06-14 00:31:53,"What's it going to take to get you to buy My book http://t.co/W3sRkyDGaq?
A rave from the New York Times? 
Fine:
http://t.co/ET1HTDEJ0w"
345283450061848576,2013-06-13 20:56:04,Father's Day's coming up. I bet Jesus gets Me cuff links again. #passiveaggressive
345217744838479872,2013-06-13 16:34:58,"When bad things happen to you don't take it personally, because I barely know you."
344891258763890688,2013-06-12 18:57:38,I support marijuana. I created it for you. In fact the Garden of Eden was full of it. That was Eve's downfall. She got the munchies.
344659940566265856,2013-06-12 03:38:27,"Before you judge someone, stop and think about how fun it's going to be."
344625833706655744,2013-06-12 01:22:56,Techies: Anyone know how to convert an HTML file to Christianity? I tried baptizing the computer but it only made it worse.
344604530253643780,2013-06-11 23:58:17,St. Fu is the patron saint of shutting the fuck up.
344600453910237185,2013-06-11 23:42:05,I find the vast majority of you profoundly unpleasant.
344472392086720512,2013-06-11 15:13:12,John 3:16. Matthew 3:17. Luke 3:18. It was a very close race.
344298450155880448,2013-06-11 03:42:01,Isn't it far more comforting to believe shit happens for no reason than that shit happens because I'm an angry son of a bitch?
344286098480041985,2013-06-11 02:52:57,Artificial intelligence can never replace natural stupidity.
344262052363264001,2013-06-11 01:17:24,"Once you go black hole, you never go back. That is literally true."
344210124413472770,2013-06-10 21:51:03,"Tebow to the Patriots?
BRADY: What'd you do last night?
TEBOW: Study the Bible. You?
BRADY: Bang Gisele Bundchen.
[Awkward silence.]"
344159685420650496,2013-06-10 18:30:37,I'm bigger than the Beatles!
344125059801165824,2013-06-10 16:13:02,People often say things in the heat of anger that in hindsight they regret not accompanying with a punch in the face.
344112427924877312,2013-06-10 15:22:50,"Even on the first day of Creation I remember thinking to Myself, ""I hate Mondays""."
343878441050980353,2013-06-09 23:53:03,The NSA knows more about you than I do.
343832349055791104,2013-06-09 20:49:54,Time is money. Money talks. So time talks. But talk is cheap. So time is cheap. But time is money. So money is cheap. Which it's not.
343814612388560896,2013-06-09 19:39:26,"Lying makes Jesus cry. Stealing makes Jesus cry. Jaywalking makes Jesus cry. A real pussy, that kid."
343787063566557184,2013-06-09 17:49:57,"There is a book with stories about incest, genocide, rape and crucifixion in almost every hotel room in the world."
343762638314020866,2013-06-09 16:12:54,"Every time you sing ""What a Friend We Have in Jesus"" I'm reminded how much I disapprove of My son's friends."
343732472829329408,2013-06-09 14:13:02,I need to be told how great I am at least once a week by everybody because while I am perfect I am also very emotionally needy.
343585297738653696,2013-06-09 04:28:13,I watch sporting events and decide their outcome because that is a very important priority for Me.
343579718618058752,2013-06-09 04:06:02,"You're welcome, Chicago."
343505007800369152,2013-06-08 23:09:10,I designed the sun to be 100% solar-powered. #green
343397376926547968,2013-06-08 16:01:29,The reason I ask for so much money is I have a child to support.
343224787310628866,2013-06-08 04:35:40,In America it's 'humor'. In England it's 'humour'. In Germany it's 'unheard-of'.
343214023157882880,2013-06-08 03:52:54,"Americans consume 80% of the world's painkillers. Amazing, since they suffer only .0008% of the world's pain."
343030813383856129,2013-06-07 15:44:53,Nadal and Djokovic create more from clay than I did.
342861588690268160,2013-06-07 04:32:27,The hardest part about being perfect is I have no excuse when I screw things up.
342381771733757953,2013-06-05 20:45:50,Not feeling too good. May call in nonexistent tomorrow.
342144201812750337,2013-06-05 05:01:49,"Child molestation! THAT was what I meant to outlaw in the Ten Commandments. Oh, and rape. #NowIRemember"
342073748519788544,2013-06-05 00:21:51,"The harder you believe in something, the nothinger of a difference it makes."
342021726001061888,2013-06-04 20:55:08,Can oral sex cause throat cancer? Possibly. Can the lack of oral sex cause marriage cancer? Definitely.
341630226821947394,2013-06-03 18:59:27,"In a dictatorship, one man fucks up the country. In a democracy, everyone does it together. #occupygezi"
341395545815912449,2013-06-03 03:26:55,I support the separation of church and reality.
341363804657029120,2013-06-03 01:20:47,"Turkey's Islamist President says ""Whoever drinks alcohol is alcoholic."" By that logic whoever holds power is autocratic. #occupygezi"
341339872432386049,2013-06-02 23:45:42,"People who believe in ""traditional marriage"" are nostalgic for the days of dowries, aristocratic inbreeding, and war rape."
341305411527376896,2013-06-02 21:28:45,"My love for you is unconditional, provided you do and think exactly as I say."
341033111427100672,2013-06-02 03:26:44,"Everything happens for a reason, and the reason is I don't know what I'm doing."
341020983584493570,2013-06-02 02:38:33,One thing makes Christianity superior to Judaism and Islam: grilled cheese with bacon.
340952242851045377,2013-06-01 22:05:23,"If you think about it, the fact that people swear to tell the truth, the whole truth and nothing but the truth on the Bible is pretty funny."
340606151840374785,2013-05-31 23:10:09,"Please stay safe, Oklahoma, because evidently I'm angry at you again for absolutely no reason."
340586154975952896,2013-05-31 21:50:41,"It's not that 10% of you came out wrong, it's that I'm 10% gay.

http://t.co/L7COcmMajx"
340553202195902464,2013-05-31 19:39:45,Retweet this and win eternal life and/or $2 off your next burrito at Chipotle!
340261535899328512,2013-05-31 00:20:46,The twist ending to M. Night Shyamalan's career is that it turns out it was dead the whole time.
340231188599943168,2013-05-30 22:20:11,My social media consultant says I need to do a better job using hashtags. #FuckThatGuy
340139985476939776,2013-05-30 16:17:46,"As of today I'm officially off sneeze duty. You want your mucus blessed, bring it to a priest."
339965901132673024,2013-05-30 04:46:01,If you're a straight married person who thinks same-sex marriage brings shame on you shame on you.
339961262945468416,2013-05-30 04:27:35,Ancient cryptic thrice-translated self-contradictory texts are the best way to convey moral precepts.
339892730069139458,2013-05-29 23:55:16,"Hey, you've reached God. I'm not here now, but if you leave your name, number and a brief message, I will never ever ever return your call."
339841478249553920,2013-05-29 20:31:37,I really appreciate all the hate you spread and killing you do in My name. It's exactly what I want and the best use of your time on Earth.
339510526444990464,2013-05-28 22:36:31,"You keep praying to Me, and I keep not answering! It's hilarious, really."
339393181990920196,2013-05-28 14:50:14,When I work in mysterious ways it's called grace. When you work in mysterious ways it's called grounds for termination.
339384276560801792,2013-05-28 14:14:51,Your right to be stupid does not change the fact that you're stupid.
339373292278390784,2013-05-28 13:31:12,"I don't wake up thinking ""I need to kill 155,000 people today."" But then this happens, that happens, yada yada yada, and 155,000 people die."
339186311829274624,2013-05-28 01:08:13,"If ignorance is bliss, why is the world so unhappy?"
339133546021154816,2013-05-27 21:38:32,"The question is no longer ""What kind of world are you leaving for your children?"" but ""Why even bother having children?"""
339086957508427778,2013-05-27 18:33:25,Good things come to those who pay for them.
338824520876044288,2013-05-27 01:10:35,"""RIP Lady Gaga"" is trending? Please! Lady Gaga's not going to die. At least not until Madonna does it first."
338822693388447745,2013-05-27 01:03:19,I've made a huge mistake.
338786990969479168,2013-05-26 22:41:27,"Yes!!!

@TheTweetOfGod 723.9K followers
@RichardDawkins 723.6K followers

Believe in THAT, Dick! 
It's no ""delusion""!
I WIN I WIN I WIN!!!"
338716480118063105,2013-05-26 18:01:16,"Am I pro-life? Yes, but if you're familiar with My work you know I'm not exactly anti-death, either."
338654269957885954,2013-05-26 13:54:04,It's not that I don't exist. It's that I don't give a crap.
338513568418914304,2013-05-26 04:34:58,Man shall not live on bread alone. Yet it is easy to forget this at restaurants and end up full before the appetizer.
338459491806887936,2013-05-26 01:00:05,"The first person to call you a jerk is probably just jealous, but the hundredth may be on to something."
338349921075863552,2013-05-25 17:44:42,"My brain says robot apocalypse, but My heart says zombie apocalypse. #torn"
338310395607543808,2013-05-25 15:07:38,Heaven is like arriving at Disneyland. Hell is like still being at Disneyland three weeks later.
338137834089234432,2013-05-25 03:41:56,"""Why did you create mosquitoes?"" A better question is ""Why did you create people?"" Answer: to feed the mosquitoes."
338047697523187712,2013-05-24 21:43:46,Orgasms are My way of apologizing for everything other than orgasms.
338013645353136128,2013-05-24 19:28:27,#FF Me or I'll fucking kill you.
338003834779602944,2013-05-24 18:49:28,Pope Francis says atheists can go to heaven? Great. There goes the neighborhood.
