id,created_at,text
468961431829118976,2014-05-21 03:48:12,I'm sorry if I come across as homophobic in the Bible. I was still working through some issues about My feelings towards Zeus.
468786946899070976,2014-05-20 16:14:52,"If you say something stupid and then defend it by saying ""I have a right to say it,"" you've now said two stupid things."
468206854397775872,2014-05-19 01:49:47,The human race is why Earth can't have nice things.
468157407169110016,2014-05-18 22:33:18,"Yes, you were all made in My image, but some of you came out very lo-res."
467803409362345985,2014-05-17 23:06:38,"The Bible only says masturbation is a sin in two places, and those pages are stuck together anyway."
467732482209488898,2014-05-17 18:24:48,"OK, #Arsenal? OK? Now leave Me alone. #FACupFinal"
467693978813353984,2014-05-17 15:51:48,"Honestly I've never heard so many prayers from @Arsenal fans in My life, and that's saying something, because they are a needy, needy bunch."
467529288711827456,2014-05-17 04:57:23,Retweeting this entitles to you 10% off the amount of good you need to do to get into heaven. (Please present proof of RT to St. Peter.)
467327617482625025,2014-05-16 15:36:01,"Just saw ""Godzilla"" and it's given Me all kinds of exciting ideas."
467138716314517504,2014-05-16 03:05:23,Sometimes I pray to Myself. I don’t answer those either.
466813263804899329,2014-05-15 05:32:09,"Congratulations India on completing the largest election in history. Obviously you're not My territory, but I hear good things from Brahma."
466721929391796224,2014-05-14 23:29:13,"Til slutt, den definitive norske artikkelen om Sekretæren min som du har ventet på. http://t.co/EeQzOWmE25"
466648286141894656,2014-05-14 18:36:35,"Once you start allowing gay people to marry, what's next? Going on with your life in exactly the same way you did before? #slipperyslope"
466435767133548544,2014-05-14 04:32:07,"#JustinBieber is a suspect in an attempted robbery. If you're first hearing that now, please RT this as thanks for the joy I've given you."
466331405312860161,2014-05-13 21:37:25,"I giveth, and I taketh away. Why? Because I recycleth."
466308381876043777,2014-05-13 20:05:56,It amazes Me that the same people who doubt that I can be on Twitter have no trouble believing Jesus is on a piece of French toast.
466268742943395840,2014-05-13 17:28:25,Overwhelming scientific evidence suggests a startling number of people are capable of ignoring overwhelming scientific evidence.
465968994860531712,2014-05-12 21:37:20,Antarctica is melting and there's no way to stop it and it's your fault and it's a catastrophe beyond comprehension. Just FYI.
465882166929264640,2014-05-12 15:52:18,If you retweet this something will happen. Just watch.
465531510771023872,2014-05-11 16:38:55,I was there when your mother conceived you. In fact she was calling My name. #awwwyeah
465511672032276480,2014-05-11 15:20:06,"Sorry, Liverpool. As usual, I'm letting you walk alone."
465337097906167808,2014-05-11 03:46:24,"If I didn't mean for some people to be gay, I wouldn't have made cock so delicious."
465300681201823744,2014-05-11 01:21:41,"An openly gay man joins the NFL, a Southern state issues same-sex marriage licenses and a drag queen wins Eurovision. #mostfabulousdayever"
465273750641197056,2014-05-10 23:34:41,Congratulations to @MikeSamFootball on being the first openly professional football player in the gay community.
464961283297513472,2014-05-10 02:53:03,People tend to greatly underestimate the frequency with which they should shut up.
464899865538224128,2014-05-09 22:49:00,I just don't like Cleveland sports.
464803484572086272,2014-05-09 16:26:01,"Retweet this and you'll get three wishes!(They won't come true or anything, but still: three wishes!)"
464526133187579904,2014-05-08 22:03:55,"THE FIVE STAGES OF GLOBAL WARMING

1. Denial
2. Guilt
3. Depression
4. Acceptance
5. Drowning"
464208985244323840,2014-05-08 01:03:41,"Hey you stupid evil crazy backwards thuggish cowardly horrible bastards, #BringBackOurGirls."
463783846212014080,2014-05-06 20:54:20,Watching #EurovisionSongContest2014 and thinking I may have created one continent too many.
463719127836680192,2014-05-06 16:37:10,I support the separation of church and reality.
463504941496025088,2014-05-06 02:26:04,"The less you know, the more you think you do."
463335535764070400,2014-05-05 15:12:54,"If the God of your universe commands you to sell schoolchildren into slavery, consider moving to another universe."
462794190569877504,2014-05-04 03:21:47,Multitasking is the first step towards multifailing.
462690788418543617,2014-05-03 20:30:54,"Everyone in ""Star Wars"".
Everyone in ""The Muppets"".
Everyone in ""Game of Thrones"".

This is now the first tweet with over 140 characters."
462410533430640640,2014-05-03 01:57:17,The key to successful prayer is to ask for something that would have happened anyway.
461684803041906688,2014-05-01 01:53:29,"Finally, the New York Times deigns to acknowledge Me! Scroll to the end: http://t.co/afnqqtuyta"
461323745169117184,2014-04-30 01:58:46,"How could Oklahoma botch an execution? If there’s one thing I would expect Americans to know how to do by now, it’s kill somebody."
461000343212421120,2014-04-29 04:33:41,"Always remember: no matter what happens, I don't care."
460555103443755008,2014-04-27 23:04:28,Mississippi could soon be the first state without an abortion clinic. That means more Mississippians would be born. You can see the problem.
460523522075262976,2014-04-27 20:58:58,I strongly dislike most of you.
460270326325063680,2014-04-27 04:12:51,Retweet this for a complimentary drink at the bar. (Just show the bartender and tell him God said to give one to you.)
460228737272152064,2014-04-27 01:27:36,"Dress for the job you want, not the job you have. In many cases this will mean showing up to the interview in a pirate suit."
460171632389021697,2014-04-26 21:40:41,One of these days someone will start a religion based on the things Jesus actually said in the Bible.
460151278463488000,2014-04-26 20:19:48,A racist NBA owner makes about as much sense as a homophobic theater producer.
459800726172991488,2014-04-25 21:06:50,"Don't let anyone call you an underachiever. If they knew you, they'd understand how amazing it is that you've managed to achieve anything."
458768351292960769,2014-04-23 00:44:33,"It’s easy to blame other people for your problems, so do that."
458640365189226496,2014-04-22 16:15:58,"Happy Earth Day to you.
Happy Earth Day to you. 
Happy Earth Day, dear planet we’re destroying.
Happy Earth Day to you."
458477345590882304,2014-04-22 05:28:11,No one ever gives the planet what it really wants for Earth Day: all of you dead.
458469259165700096,2014-04-22 04:56:03,"Things aren't getting worse, you're just getting better at noticing how bad they are."
458414212205666304,2014-04-22 01:17:19,"Practice what you preach. Better yet, don't preach."
458249003226767360,2014-04-21 14:20:50,"Man, I created some stupid-ass motherfuckers."
458070687370838016,2014-04-21 02:32:17,Retweet this and nothing will change.
458006314979835904,2014-04-20 22:16:29,Jesus’s motto was YOLT.
457908910608121856,2014-04-20 15:49:26,The odds of Jesus coming a second time are about the same as those of ANY man coming a second time. #amirightladies
457742629585686529,2014-04-20 04:48:42,“And he shall rise from the dead on the day of the sweet-smoking plant.” Mary 4:20.
457723264312172545,2014-04-20 03:31:44,"THE NEW 10 COMMANDMENTS

1 Laugh. 
2 Read.
3 Say please.
4 Floss.
5 Doubt.
6 Exercise.
7 Learn.
8 Don't hate.
9 Cut the bullshit. 
10 Chill."
457569962924576768,2014-04-19 17:22:35,The Easter Bunny is a ridiculous myth that completely detracts from the factual reality of the Son of God rising from the dead.
457377966100447232,2014-04-19 04:39:39,Jesus was the only man to return from the dead and not eat brains.
457347526828384256,2014-04-19 02:38:42,Death is a lifetime achievement award.
457292334716047360,2014-04-18 22:59:23,Thinking about ending the world this weekend so I can skip work on Monday.
457228677730676736,2014-04-18 18:46:26,"Everything happens for a reason, and the reason is I'm not very good at My job."
457197239622844417,2014-04-18 16:41:30,For Jesus this was anything but a Good Friday.
456809117491810305,2014-04-17 14:59:15,"Easter falls on 4/20. Truly, he is resin."
456275615633514496,2014-04-16 03:39:18,There is no practical distinction between the comments section of a web page and the depths of hell.
456203758129524736,2014-04-15 22:53:46,If you don't want Me watching you have sex then don't call My name.
455927559738257409,2014-04-15 04:36:15,SPOILER ALERT: You're going to hell.
455734500299796481,2014-04-14 15:49:06,The next time I create mankind I'll conduct an environmental impact study first.
455419914065428481,2014-04-13 18:59:03,Prayer is ritualized whining.
455386453657145344,2014-04-13 16:46:05,"Today, in honor of Palm Sunday, masturbate."
455045677274247168,2014-04-12 18:11:58,Instagram is working again. Please resume your staggering visual egotism.
455032686885609472,2014-04-12 17:20:21,"The question is not ""Why is Instagram not working?"", but ""Why does the world need another picture of you?""   #instagramnotworking"
454401061025882113,2014-04-10 23:30:29,Dammit. I wanted Stephen Colbert to replace Me.
453744186756300800,2014-04-09 04:00:18,The first step in religion is admitting other people have a problem.
453260607924363264,2014-04-07 19:58:44,"Most homophobes are secretly gay. However, most arachnophobes are not secretly spiders."
453188691263881216,2014-04-07 15:12:58,"Man, people are really fucking stupid."
452998342901891072,2014-04-07 02:36:35,"If you find yourself unable to watch #GameOfThrones and are craving some blood and guts, may I recommend opening your Bible?"
452633307079917569,2014-04-06 02:26:04,"If a man strikes you on one cheek, turn to him the other. Then, having shown yourself impregnable to cheek attack, beat the crap out of him."
452630736823009283,2014-04-06 02:15:51,"Jesus said ""Love your enemies"", which sounds nice until you remember what a bunch of dicks your enemies are."
452525632706969600,2014-04-05 19:18:13,I love judging people.
452492336090464257,2014-04-05 17:05:54,"Seeing is believing. Except in religion, where the opposite is true."
452295485374476288,2014-04-05 04:03:41,"Women. Can't live with 'em, can't rape 'em without paying their father 50 pieces of silver and then marrying them (Deuteronomy 22:28-29)."
452280228904071168,2014-04-05 03:03:04,I am the King of the Universe and I have a son and he occasionally appears on grilled-cheese sandwiches. #yup
452254552012500992,2014-04-05 01:21:02,Worst universe ever.
451919489018249216,2014-04-04 03:09:37,Many people don't believe in life before death.
451213073466916865,2014-04-02 04:22:34,#PrayForChile. Or help them. One or the other.
450838559113506818,2014-04-01 03:34:23,It's April 1 and when you die you're all going to heaven.
450813867845615617,2014-04-01 01:56:16,YOU ARE DESTROYING YOUR PLANET. Sorry for the all caps. But soon you will have no caps.
450452834337579008,2014-03-31 02:01:39,"Mankind is stuck in a perpetual game of ""Stop hitting yourself."""
450413999192940544,2014-03-30 23:27:20,I spend about two-thirds of My time deciding the outcome of sporting events.
450400495002087424,2014-03-30 22:33:40,"The religious groups questioning the ""accuracy"" of #Noah deserve to drown in a flood of irony."
450065651801939969,2014-03-30 00:23:07,The Bible is 100% accurate. Especially when thrown at close range.
449963553739390976,2014-03-29 17:37:25,Just saw #Noah. Now I'm all nostalgic.
449720579893915649,2014-03-29 01:31:56,Gay marriage is now legal in the UK. I now pronounce you nation and 21st century.
449669017502896128,2014-03-28 22:07:02,"There is no aspect of climate change that isn't ultimately reversible, as soon as you're all dead."
449402630754684929,2014-03-28 04:28:31,"At what point does ""not finding debris"" cease being breaking news?"
449029835457703936,2014-03-27 03:47:10,Once upon a time I killed everybody on earth except the man most worthy to live: an obsessive-compulsive animal hoarder who heard voices.
448659934402469888,2014-03-26 03:17:18,Sometimes in life all you need is fifty million dollars.
448291441387659264,2014-03-25 02:53:03,"""I'm not racist but..."" = I'm racist."
447590671612772352,2014-03-23 04:28:26,Well I don't believe in you either.
447547103804280833,2014-03-23 01:35:19,Your sports team's loss is your fault.
447508487568777217,2014-03-22 23:01:52,"Wherever the plane is, it took the last shred of CNN's credibility with it."
447433816743751680,2014-03-22 18:05:09,"Only he who has walked through the deepest valley knows how other valleys of lesser depth are relatively more walk-throughable, valley-wise."
447074643237543936,2014-03-21 18:17:55,Lord have Mercer!
446806028013694977,2014-03-21 00:30:32,"""OW!!!! OW OW OW OW OW OW OW!!! OWWWWWWWW!"" - Fred Phelps, March 20, 2014"
446679348687294464,2014-03-20 16:07:10,"Hi, Fred Phelps! Bye, Fred Phelps! *opens trapdoor*"
446499499620311041,2014-03-20 04:12:30,"The good news is, Tony Abbott says Australia may have spotted two pieces of the plane. The bad news is, Tony Abbott says a lot of things."
446439579034607616,2014-03-20 00:14:24,"""Knock knock.""
""Who's there?""
""Vladimir Putin.""
""Vladimir Putin wh-- hey, get the hell out of my house you bastard!"""
446148699987529728,2014-03-19 04:58:33,Any similarity between life and fairness is purely accidental.
446062820069609473,2014-03-18 23:17:18,This plane thing has Me beat.
445786849278033921,2014-03-18 05:00:41,The best argument creationists can make against evolution is themselves.
445581564760424450,2014-03-17 15:24:58,"On sale now, the e-book of the Bieb-book. The Book of Bieb: The Greatest Story Ever Tweeted. http://t.co/w94fcX08XA"
445552347876302848,2014-03-17 13:28:52,"Good morning, California! That was Me."
445400700147625984,2014-03-17 03:26:16,"I was going to make E just equal mc but then I thought, ""Oh, let's go nuts."""
445384469344579584,2014-03-17 02:21:47,I like Big Bangs and I cannot lie.
445261987857960961,2014-03-16 18:15:05,"Fred Phelps, I'll see you soon. Kidding! I won't be seeing you."
445018908479602689,2014-03-16 02:09:10,"Pre-order the e-book that cost Me 31,000 followers! #TheBookOfBieb, available at Amazon starting Monday. http://t.co/DblEEvXNaO"
444911179224195072,2014-03-15 19:01:05,"Once you accept that nothing makes sense, everything makes sense."
444684933127098371,2014-03-15 04:02:04,The only thing standing between you and your dreams is insomnia.
444540519302311936,2014-03-14 18:28:13,"RT @justinbieber: Be kind loving to each other, forgive each other as god forgave us through Christ Merry Christmas  IM HERE FOREVER"
444539961514409985,2014-03-14 18:26:00,"RT @justinbieber: The media talks a lot about me.They make a up a lot of lies and want me to fail but I'm never leaving you, being a belieb…"
444539470139109376,2014-03-14 18:24:03,RT @justinbieber: My beloved beliebers I'm officially retiring
444509258982637569,2014-03-14 16:24:00,RT @justinbieber: ITALY SEE U SOON! i want pasta.
444508819155345408,2014-03-14 16:22:15,RT @justinbieber: Good day
444508262625734656,2014-03-14 16:20:03,RT @justinbieber: How r u?
444507790330310657,2014-03-14 16:18:10,RT @justinbieber: hola
444093448044281856,2014-03-13 12:51:43,I don't know where the plane is either.
443754553964371969,2014-03-12 14:25:04,"Sometimes, if you believe in something hard enough and deeply enough, nothing happens."
443594040970203137,2014-03-12 03:47:15,The easily offended deserve to be easily offended.
443537363629641728,2014-03-12 00:02:02,You are remarkably unimportant.
443470135454470144,2014-03-11 19:34:54,I am pleased to announce that I have been re-elected God with 100% of the vote.
443457327597760512,2014-03-11 18:44:00,I shut down Twitter and I can shut you down too.
441432078341525504,2014-03-06 04:36:23,I need to be praised and acknowledged constantly because although I am omnipotent I am extremely insecure.
441233165336576000,2014-03-05 15:25:58,"Swearing to tell the truth, the whole truth and nothing but the truth ON A BIBLE is one of the great ironies of life."
441041171335225345,2014-03-05 02:43:04,If caring is a crime I'm innocent.
440853181325537280,2014-03-04 14:16:03,"'Twas the day before Lent, and when it was done, not a creature was sober, not even a nun."
440727769815605248,2014-03-04 05:57:43,To you it's creationism. To Me it's fan fiction.
440680194236366849,2014-03-04 02:48:40,When I made Lebron James I was in the zone.
440349126232797184,2014-03-03 04:53:07,YES! YOU'RE WELCOME MATTHEW!
440339688050937856,2014-03-03 04:15:37,How dare all these people win awards for Gravity?!? I CREATED GRAVITY!
440333093736443904,2014-03-03 03:49:25,"If you were counting at home, there were five women in that heroes' montage. And about 100 guys."
440326788754206721,2014-03-03 03:24:21,I got angry no one was thanking Me so I broke Twitter.
440321664849436672,2014-03-03 03:04:00,Please retweet this tweet telling you not to retweet Ellen's tweet.
440252794201600000,2014-03-02 22:30:20,My choice for Best Picture. http://t.co/EBBmYiskFv
440186819871662080,2014-03-02 18:08:10,I think you should see other gods.
439936637884067840,2014-03-02 01:34:02,Too many people use real life as a way to escape Twitter.
439829630904565761,2014-03-01 18:28:50,"Ah, the looming threat of war between Russia and the United States. Really takes you back."
439607987359858688,2014-03-01 03:48:06,I apologize to a tiny minority of you for the vast majority of you.
439189878417264641,2014-02-28 00:06:41,Human beings are the only creatures on earth with the potential to make themselves the only creatures on earth.
439183945767206912,2014-02-27 23:43:06,Many people go their whole lives without realizing they're stupid.
439147767458693120,2014-02-27 21:19:21,"In two totally different senses, gay men, and the people who persecute them, are fucking assholes."
438882767351189504,2014-02-27 03:46:20,Jesus tried Crossfit once. He didn't like it.
438747973900464128,2014-02-26 18:50:43,"Taco Bell is adding a burrito wrapped in a quesadilla to its menu, which means I'll be meeting a lot more of you very soon."
438688529141350400,2014-02-26 14:54:30,My last name is Zilla.
438522115122143232,2014-02-26 03:53:14,"Give a man a fish, he'll eat for a day. Teach a man to fish, he'll add to the global overdepletion of the oceans. So just give him the fish."
438514128341041152,2014-02-26 03:21:30,Give a man a fish and he'll eat for a day. Sell a man a fish and he'll eat for a day and you'll make some money.
438479291945218048,2014-02-26 01:03:04,There are a lot of you Jesus regrets dying for.
438447672479866880,2014-02-25 22:57:25,I support traditional marriage between a man and one of his own ribs.
438143158841405440,2014-02-25 02:47:24,"Overwhelming inarguable scientific evidence is no match for a guy who ""just knows""."
438121669215809536,2014-02-25 01:22:00,The last five people left after climate change kills everyone will form a panel to investigate whether climate change is real.
438002318223482880,2014-02-24 17:27:45,"Harold Ramis, dead at 69. Exhibit #984,225,642,095,423 in the case that I'm an asshole."
437487219909984256,2014-02-23 07:20:56,"For Me human history has been like some horrible children's piano recital I've been sitting through for 10,000 years."
437371434948501504,2014-02-22 23:40:50,You are all literally homos.
437368492669431809,2014-02-22 23:29:09,I created the whole universe just for humanity. The other million billion billion stars were just shits and giggles.
437271976227262466,2014-02-22 17:05:37,US hockey is Finnished.
437059464034664448,2014-02-22 03:01:11,Sooner or later everything sucks.
436940521190072320,2014-02-21 19:08:32,Bieber stays American!
436715937471803392,2014-02-21 04:16:07,"You never have to worry about being embarrassed or ashamed to tell Me anything, because I'm not listening anyway."
436592494604595200,2014-02-20 20:05:36,I have to help Canada at hockey because it's all they have up there besides civility and poutine.
436589354744426496,2014-02-20 19:53:08,"OK, seriously, that's the LAST time I help you out, Canada. This time I mean it. #USAvsCanada #womenshockey #CanvsUSA"
436381886995132416,2014-02-20 06:08:44,Every time you retweet Me an angel gets laid.
436283023768576000,2014-02-19 23:35:53,"Out of curiosity, where were you all thinking of moving after you're done destroying the Earth? 'Cause I assume you've thought that through."
436224414040854528,2014-02-19 19:42:59,Coming soon: USA-Canada in hockey. Loser has to keep Bieb.
436218172123779074,2014-02-19 19:18:11,"If the Latvian goalie guarded heaven's gate, no one would ever get in."
436216000283811840,2014-02-19 19:09:33,"That's the last time I do anything nice for you, Canada."
436023509039333377,2014-02-19 06:24:40,Stop focusing on tiny made-up reasons to kill each other and start focusing on the enormous actual things that will kill all of you.
435983055769989121,2014-02-19 03:43:55,Believing is to thinking what unicorns are to horses.
435965628256505856,2014-02-19 02:34:40,I give up.
435643081757433857,2014-02-18 05:12:59,"Please take everything I say as a joke except when it applies to you, in which case take it very seriously and be offended."
435635582836813824,2014-02-18 04:43:11,Uganda is passing a law sentencing gays to life in prison. That's even worse than life in Uganda.
435577598291083265,2014-02-18 00:52:46,The people in charge of hell sometimes visit North Korea just to exchange ideas.
435529829962620929,2014-02-17 21:42:57,"Atheists, please stop referring to Me as an ""imaginary friend"". I'm nobody's friend."
435499978983612417,2014-02-17 19:44:20,The main prerequisite for admission to heaven is proper grammar.
435435396613169152,2014-02-17 15:27:43,"""Zimmerman: 'Only God Can Judge Me'."" Done."
435263248783273984,2014-02-17 04:03:39,"If hearing about the Pentecostal snake handler who died of a snakebite doesn't make you laugh out loud, you're dead inside."
434926522227359745,2014-02-16 05:45:38,I'm so horny I could Bang a universe.
434901293782401025,2014-02-16 04:05:23,"Cats have nine lives, but many cat owners have none."
434799355548012545,2014-02-15 21:20:19,Being gay is far less of a choice than being an asshole.
434499518592077824,2014-02-15 01:28:52,"Hot off My fantastic interview with @neiltyson, My pathetic scribe sits down with CBC Radio. http://t.co/dtN6x2yVEC"
434427721729331201,2014-02-14 20:43:34,I'm single and loving it.
434171199745060865,2014-02-14 03:44:15,"There's only so much you can do, but there's also so much only you can do."
434153061666148354,2014-02-14 02:32:10,"For Valentine's Day I don't want anything special. Just my usual 145,000 dead bodies."
434076720023363584,2014-02-13 21:28:49,Thinking about merging with Comcast.
433820826605850624,2014-02-13 04:31:59,If there are any more bad weather days Earth is cancelled.
433607292806643713,2014-02-12 14:23:29,"Yes, all this misery is punishment for gay marriage. You're not legalizing it fast enough."
433600425720164352,2014-02-12 13:56:12,"You do realize the awful weather is only the beginning of a century of catastrophe, right? ‘Cause if not, heads up on that."
433434863794810880,2014-02-12 02:58:19,"Actual birds go extinct all the time and no one cares but Flappy Bird goes extinct and holy shit, let's all panic."
433223996545331200,2014-02-11 13:00:24,"RIP Shirley Temple, who paved the way for hundreds of other child stars, except for the part where she grew up and had a normal happy life."
433117875289595904,2014-02-11 05:58:43,Retweeting this will make you a better person.
433057826018054144,2014-02-11 02:00:06,"Don't worry. I'm not going to send another flood to destroy you all. This time, I'm letting you do it yourself."
433038924768747520,2014-02-11 00:44:59,Prayers are My spam.
433004633699532800,2014-02-10 22:28:44,"""Iraqi Suicide Bomb Instructor Accidentally Kills 22 Pupils."" Finally, some school violence everybody can support."
432877638307168256,2014-02-10 14:04:06,"From the very first day of Creation, Mondays sucked."
432686052818432003,2014-02-10 01:22:48,Michael Sam. He's here. He's queer. Get used to him sacking your quarterback. #whoohoo
432608862311424000,2014-02-09 20:16:04,If you want to change the world you're gonna need a big diaper.
432599844595589120,2014-02-09 19:40:14,I invented religion to keep humanity the hell away from Me.
432358628029255680,2014-02-09 03:41:44,If you're not competing for an Olympic medal by age 15 you're a failure.
432323253810384896,2014-02-09 01:21:10,"You're entitled to your opinion, and I'm entitled to know you're wrong and stupid."
432153905976197120,2014-02-08 14:08:14,"Yes, I have forsaken Arsenal."
431988401567309825,2014-02-08 03:10:35,I have no plan for your life.
431645244073865216,2014-02-07 04:27:00,"I created man. Man created Flappy Birds. Fuck you, man."
431620895619031043,2014-02-07 02:50:15,McDonald's sponsoring the Olympics is like Jack Daniels sponsoring the prom.
431508221245657089,2014-02-06 19:22:31,"If the Sochi Olympic organizers are so homophobic, why are they allowing figure skating?"
431306378724929536,2014-02-06 06:00:28,The more I learn about Myself the more atheist I become.
430884033342349312,2014-02-05 02:02:13,"After the #creationdebate, be sure to stay tuned for the #gravitydebate. Do things fall when you drop them? Find out tonight!"
430857048440315904,2014-02-05 00:14:59,"""Creation science"" carries the same intellectual weight as ""dragon anatomy"". #creationdebate"
